CREATE EXTENSION mtree_am;
CREATE TABLE mtree_tab (a int) USING mtree_am;
SELECT * FROM mtree_tab;
 a 
---
(0 rows)

INSERT INTO mtree_tab VALUES (1);
SELECT * FROM mtree_tab;
 a 
---
(0 rows)

UPDATE mtree_tab SET a = 0 WHERE a = 1;
SELECT * FROM mtree_tab;
 a 
---
(0 rows)

DELETE FROM mtree_tab WHERE a = 1;
SELECT * FROM mtree_tab;
 a 
---
(0 rows)

-- ALTER TABLE SET ACCESS METHOD
ALTER TABLE mtree_tab SET ACCESS METHOD heap;
INSERT INTO mtree_tab VALUES (1);
SELECT * FROM mtree_tab;
 a 
---
 1
(1 row)

ALTER TABLE mtree_tab SET ACCESS METHOD mtree_am;
SELECT * FROM mtree_tab;
 a 
---
(0 rows)

-- Clean up
DROP TABLE mtree_tab;
